{
  "schema": "kenshou.perf-calibration-definition/v1",
  "batchId": "0199a3c3-7b1e-7c44-9d0a-3f5e2a61b7c9",
  "project": "mori://fixture/runtime",
  "profile": "synthetic-core",
  "workloadSha256": "sha256:aaaaaaaaaaaaaaaaaaaaaaaaaaaaaaaaaaaaaaaaaaaaaaaaaaaaaaaaaaaaaaaa",
  "toolchainSha256": "sha256:bbbbbbbbbbbbbbbbbbbbbbbbbbbbbbbbbbbbbbbbbbbbbbbbbbbbbbbbbbbbbbbb",
  "harnessSemanticsSha256": "sha256:cccccccccccccccccccccccccccccccccccccccccccccccccccccccccccccccc",
  "baselineRevision": "aaaaaaaaaaaaaaaaaaaaaaaaaaaaaaaaaaaaaaaa",
  "slowdownRevision": "bbbbbbbbbbbbbbbbbbbbbbbbbbbbbbbbbbbbbbbb",
  "injectionMechanism": "Synthetic codec control only; no runtime evidence.",
  "targetMetric": "op.latency.p99",
  "targetRelativeEffect": 0.5,
  "targetAbsoluteEffect": 1000000,
  "seeds": [
    1,
    2,
    3,
    4,
    5,
    6,
    7,
    8,
    9,
    10,
    11,
    12,
    13,
    14,
    15,
    16,
    17,
    18,
    19,
    20
  ],
  "infrastructureRetryCap": 1,
  "expiresAt": "2026-10-12T00:00:00Z",
  "machineProfile": "synthetic-machine-no-live-evidence"
}
